{
 "consts": [
  {
   "k": "const",
   "name": "minI64",
   "type": null,
   "value": {
    "k": "unary",
    "op": "-",
    "x": {
     "k": "int",
     "value": "9223372036854775808"
    }
   }
  }
 ],
 "funcs": [
  {
   "body": [
    {
     "k": "incdec",
     "lhs": {
      "k": "field",
      "name": "n",
      "x": {
       "k": "ident",
       "name": "c"
      }
     },
     "op": "++"
    },
    {
     "k": "assign",
     "lhs": [
      {
       "k": "field",
       "name": "log",
       "x": {
        "k": "ident",
        "name": "c"
       }
      }
     ],
     "value": {
      "args": [
       {
        "k": "field",
        "name": "log",
        "x": {
         "k": "ident",
         "name": "c"
        }
       },
       {
        "k": "ident",
        "name": "tag"
       }
      ],
      "fn": "append",
      "k": "builtin",
      "spread": false,
      "type": null
     }
    },
    {
     "k": "return",
     "values": [
      {
       "k": "conv",
       "type": {
        "k": "named",
        "name": "int64"
       },
       "x": {
        "k": "ident",
        "name": "tag"
       }
      }
     ]
    }
   ],
   "k": "func",
   "name": "bump",
   "params": [
    {
     "name": "c",
     "type": {
      "k": "ptr",
      "name": "Counter"
     }
    },
    {
     "name": "tag",
     "type": {
      "k": "named",
      "name": "int32"
     }
    }
   ],
   "results": [
    {
     "k": "named",
     "name": "int64"
    }
   ]
  },
  {
   "body": [
    {
     "k": "define",
     "names": [
      "v"
     ],
     "value": {
      "k": "conv",
      "type": {
       "k": "named",
       "name": "int64"
      },
      "x": {
       "k": "int",
       "value": "0"
      }
     }
    },
    {
     "body": [
      {
       "k": "assign",
       "lhs": [
        {
         "k": "ident",
         "name": "v"
        }
       ],
       "value": {
        "k": "binary",
        "op": "+",
        "x": {
         "k": "binary",
         "op": "*",
         "x": {
          "k": "ident",
          "name": "v"
         },
         "y": {
          "k": "int",
          "value": "10"
         }
        },
        "y": {
         "k": "conv",
         "type": {
          "k": "named",
          "name": "int64"
         },
         "x": {
          "index": {
           "k": "ident",
           "name": "i"
          },
          "k": "index",
          "x": {
           "k": "field",
           "name": "log",
           "x": {
            "k": "ident",
            "name": "c"
           }
          }
         }
        }
       }
      }
     ],
     "cond": {
      "k": "binary",
      "op": "\u003c",
      "x": {
       "k": "ident",
       "name": "i"
      },
      "y": {
       "args": [
        {
         "k": "field",
         "name": "log",
         "x": {
          "k": "ident",
          "name": "c"
         }
        }
       ],
       "fn": "len",
       "k": "builtin",
       "spread": false,
       "type": null
      }
     },
     "init": {
      "k": "define",
      "names": [
       "i"
      ],
      "value": {
       "k": "int",
       "value": "0"
      }
     },
     "k": "for",
     "post": {
      "k": "incdec",
      "lhs": {
       "k": "ident",
       "name": "i"
      },
      "op": "++"
     }
    },
    {
     "k": "return",
     "values": [
      {
       "k": "binary",
       "op": "+",
       "x": {
        "k": "binary",
        "op": "*",
        "x": {
         "k": "ident",
         "name": "v"
        },
        "y": {
         "k": "int",
         "value": "100"
        }
       },
       "y": {
        "k": "conv",
        "type": {
         "k": "named",
         "name": "int64"
        },
        "x": {
         "k": "field",
         "name": "n",
         "x": {
          "k": "ident",
          "name": "c"
         }
        }
       }
      }
     ]
    }
   ],
   "k": "func",
   "name": "logCode",
   "params": [
    {
     "name": "c",
     "type": {
      "k": "ptr",
      "name": "Counter"
     }
    }
   ],
   "results": [
    {
     "k": "named",
     "name": "int64"
    }
   ]
  },
  {
   "body": [
    {
     "k": "return",
     "values": [
      {
       "k": "binary",
       "op": "/",
       "x": {
        "k": "ident",
        "name": "a"
       },
       "y": {
        "k": "ident",
        "name": "b"
       }
      },
      {
       "k": "binary",
       "op": "%",
       "x": {
        "k": "ident",
        "name": "a"
       },
       "y": {
        "k": "ident",
        "name": "b"
       }
      }
     ]
    }
   ],
   "k": "func",
   "name": "DivMod",
   "params": [
    {
     "name": "a",
     "type": {
      "k": "named",
      "name": "int64"
     }
    },
    {
     "name": "b",
     "type": {
      "k": "named",
      "name": "int64"
     }
    }
   ],
   "results": [
    {
     "k": "named",
     "name": "int64"
    },
    {
     "k": "named",
     "name": "int64"
    }
   ]
  },
  {
   "body": [
    {
     "k": "return",
     "values": [
      {
       "k": "binary",
       "op": "/",
       "x": {
        "k": "ident",
        "name": "a"
       },
       "y": {
        "k": "ident",
        "name": "b"
       }
      },
      {
       "k": "binary",
       "op": "%",
       "x": {
        "k": "ident",
        "name": "a"
       },
       "y": {
        "k": "ident",
        "name": "b"
       }
      }
     ]
    }
   ],
   "k": "func",
   "name": "DivMod32",
   "params": [
    {
     "name": "a",
     "type": {
      "k": "named",
      "name": "int32"
     }
    },
    {
     "name": "b",
     "type": {
      "k": "named",
      "name": "int32"
     }
    }
   ],
   "results": [
    {
     "k": "named",
     "name": "int32"
    },
    {
     "k": "named",
     "name": "int32"
    }
   ]
  },
  {
   "body": [
    {
     "k": "define",
     "names": [
      "b"
     ],
     "value": {
      "k": "conv",
      "type": {
       "elem": {
        "k": "named",
        "name": "uint8"
       },
       "k": "slice"
      },
      "x": {
       "k": "ident",
       "name": "s"
      }
     }
    },
    {
     "cond": {
      "k": "binary",
      "op": "\u003e",
      "x": {
       "args": [
        {
         "k": "ident",
         "name": "b"
        }
       ],
       "fn": "len",
       "k": "builtin",
       "spread": false,
       "type": null
      },
      "y": {
       "k": "int",
       "value": "0"
      }
     },
     "else": null,
     "k": "if",
     "then": [
      {
       "k": "assign",
       "lhs": [
        {
         "index": {
          "k": "int",
          "value": "0"
         },
         "k": "index",
         "x": {
          "k": "ident",
          "name": "b"
         }
        }
       ],
       "value": {
        "k": "char",
        "value": "88"
       }
      }
     ]
    },
    {
     "k": "define",
     "names": [
      "t"
     ],
     "value": {
      "k": "conv",
      "type": {
       "k": "named",
       "name": "int64"
      },
      "x": {
       "k": "int",
       "value": "0"
      }
     }
    },
    {
     "body": [
      {
       "k": "assign",
       "lhs": [
        {
         "k": "ident",
         "name": "t"
        }
       ],
       "value": {
        "k": "binary",
        "op": "+",
        "x": {
         "k": "binary",
         "op": "*",
         "x": {
          "k": "ident",
          "name": "t"
         },
         "y": {
          "k": "int",
          "value": "31"
         }
        },
        "y": {
         "k": "conv",
         "type": {
          "k": "named",
          "name": "int64"
         },
         "x": {
          "index": {
           "k": "ident",
           "name": "i"
          },
          "k": "index",
          "x": {
           "k": "ident",
           "name": "b"
          }
         }
        }
       }
      }
     ],
     "cond": {
      "k": "binary",
      "op": "\u003c",
      "x": {
       "k": "ident",
       "name": "i"
      },
      "y": {
       "args": [
        {
         "k": "ident",
         "name": "b"
        }
       ],
       "fn": "len",
       "k": "builtin",
       "spread": false,
       "type": null
      }
     },
     "init": {
      "k": "define",
      "names": [
       "i"
      ],
      "value": {
       "k": "int",
       "value": "0"
      }
     },
     "k": "for",
     "post": {
      "k": "incdec",
      "lhs": {
       "k": "ident",
       "name": "i"
      },
      "op": "++"
     }
    },
    {
     "k": "return",
     "values": [
      {
       "k": "ident",
       "name": "t"
      }
     ]
    }
   ],
   "k": "func",
   "name": "BytesProbe",
   "params": [
    {
     "name": "s",
     "type": {
      "k": "named",
      "name": "string"
     }
    }
   ],
   "results": [
    {
     "k": "named",
     "name": "int64"
    }
   ]
  },
  {
   "body": [
    {
     "k": "incdec",
     "lhs": {
      "k": "field",
      "name": "n",
      "x": {
       "k": "ident",
       "name": "c"
      }
     },
     "op": "++"
    },
    {
     "k": "define",
     "names": [
      "out"
     ],
     "value": {
      "args": [
       {
        "k": "ident",
        "name": "n"
       }
      ],
      "fn": "make",
      "k": "builtin",
      "spread": false,
      "type": {
       "elem": {
        "k": "named",
        "name": "int32"
       },
       "k": "slice"
      }
     }
    },
    {
     "body": [
      {
       "k": "assign",
       "lhs": [
        {
         "index": {
          "k": "ident",
          "name": "i"
         },
         "k": "index",
         "x": {
          "k": "ident",
          "name": "out"
         }
        }
       ],
       "value": {
        "k": "conv",
        "type": {
         "k": "named",
         "name": "int32"
        },
        "x": {
         "k": "binary",
         "op": "+",
         "x": {
          "k": "ident",
          "name": "i"
         },
         "y": {
          "k": "int",
          "value": "1"
         }
        }
       }
      }
     ],
     "cond": {